{
  "id": "com.haas.transcode-engine",
  "name": "Transcode Engine",
  "publisher": {
    "name": "Haas",
    "url": "https://github.com/alex-de-haas",
    "email": "a.zayats@outlook.com"
  },
  "category": "Media",
  "tags": [
    "transcode",
    "ffmpeg",
    "video",
    "hardware-acceleration",
    "engine"
  ],
  "feedsUrl": "https://raw.githubusercontent.com/alex-de-haas/transcode-engine/main/feeds.json",
  "signerIdentity": "github.com/alex-de-haas/transcode-engine"
}
